[
  {
    "template_id": "DAILY.DIGEST.001",
    "type": "DIGEST",
    "text": "Today invites a slower, more attentive pace.",
    "human_text": "Today invites a slower, more attentive pace."
  },
  {
    "template_id": "DAILY.DIGEST.002",
    "type": "DIGEST",
    "text": "Notice what quietly asks for your attention.",
    "human_text": "Notice what quietly asks for your attention."
  },
  {
    "template_id": "DAILY.DIGEST.003",
    "type": "DIGEST",
    "text": "Not everything needs action today — some things need clarity.",
    "human_text": "Not everything needs action today — some things need clarity."
  },
  {
    "template_id": "DAILY.DIGEST.004",
    "type": "DIGEST",
    "text": "Your inner state matters more than external speed.",
    "human_text": "Your inner state matters more than external speed."
  },
  {
    "template_id": "DAILY.DIGEST.005",
    "type": "DIGEST",
    "text": "Small, conscious choices shape the whole day.",
    "human_text": "Small, conscious choices shape the whole day."
  },
  {
    "template_id": "DAILY.DIGEST.006",
    "type": "DIGEST",
    "text": "Stay close to what feels true, even if it’s subtle.",
    "human_text": "Stay close to what feels true, even if it’s subtle."
  },
  {
    "template_id": "DAILY.DIGEST.007",
    "type": "DIGEST",
    "text": "Energy flows best when you don’t rush it.",
    "human_text": "Energy flows best when you don’t rush it."
  },
  {
    "template_id": "DAILY.DIGEST.008",
    "type": "DIGEST",
    "text": "Let today be guided by awareness, not pressure.",
    "human_text": "Let today be guided by awareness, not pressure."
  },
  {
    "template_id": "DAILY.DIGEST.009",
    "type": "DIGEST",
    "text": "You don’t need to fix anything — just stay present.",
    "human_text": "You don’t need to fix anything — just stay present."
  },
  {
    "template_id": "DAILY.DIGEST.010",
    "type": "DIGEST",
    "text": "Clarity grows when you give yourself space.",
    "human_text": "Clarity grows when you give yourself space."
  },
  {
    "template_id": "DAILY.DIGEST.011",
    "type": "DIGEST",
    "text": "Today favors reflection over reaction.",
    "human_text": "Today favors reflection over reaction."
  },
  {
    "template_id": "DAILY.DIGEST.012",
    "type": "DIGEST",
    "text": "What feels unclear now may resolve if you don’t push it.",
    "human_text": "What feels unclear now may resolve if you don’t push it."
  },
  {
    "template_id": "DAILY.DIGEST.013",
    "type": "DIGEST",
    "text": "Let attention move toward what feels steady.",
    "human_text": "Let attention move toward what feels steady."
  },
  {
    "template_id": "DAILY.DIGEST.014",
    "type": "DIGEST",
    "text": "Notice where effort can soften.",
    "human_text": "Notice where effort can soften."
  },
  {
    "template_id": "DAILY.DIGEST.015",
    "type": "DIGEST",
    "text": "You don’t need full certainty to move gently forward.",
    "human_text": "You don’t need full certainty to move gently forward."
  },
  {
    "template_id": "DAILY.DIGEST.016",
    "type": "DIGEST",
    "text": "Give yourself permission to pause between decisions.",
    "human_text": "Give yourself permission to pause between decisions."
  },
  {
    "template_id": "DAILY.DIGEST.017",
    "type": "DIGEST",
    "text": "The day responds better to presence than control.",
    "human_text": "The day responds better to presence than control."
  },
  {
    "template_id": "DAILY.DIGEST.018",
    "type": "DIGEST",
    "text": "What you slow down for becomes clearer.",
    "human_text": "What you slow down for becomes clearer."
  },
  {
    "template_id": "DAILY.DIGEST.019",
    "type": "DIGEST",
    "text": "Let priorities emerge instead of forcing them.",
    "human_text": "Let priorities emerge instead of forcing them."
  },
  {
    "template_id": "DAILY.DIGEST.020",
    "type": "DIGEST",
    "text": "Stay attentive to signals that come quietly.",
    "human_text": "Stay attentive to signals that come quietly."
  }
]